case_id,museum_id,mode,variant,status,skip_reason,error,notes,query,q1,q2,rewritten_query,message,input_path,input_id,input_used,ranking_artifact_ids,q1_ranking_artifact_ids,target_artifact,relevant_artifacts,recall_at_1,recall_at_5,mrr,ndcg_at_5,latency_first_ms,latency_final_ms,result_count
T01,mnaz,text_single,full,scored,,,Todos os Sinais,painel com cabeca de perfil e coracao,,,,,,,painel com cabeca de perfil e coracao,artifact_159342|artifact_159343|artifact_100412|artifact_159331|artifact_101232,,artifact_100000,,0.0,0.0,0.0,,,141.2919360009255,5
T02,mnaz,text_single,full,scored,,,Budapeste / caligrafia gestual,painel com poema de Mario Cesariny,,,,,,,painel com poema de Mario Cesariny,artifact_33353|artifact_105515|artifact_105524|artifact_100002|artifact_33385,,artifact_100002,,0.0,1.0,0.25,,,189.53806399804307,5
T03,mnaz,text_single,full,scored,,,Same artifact as T02 in the PDF,painel relacionado com a estacao Deak Ter de Budapeste,,,,,,,painel relacionado com a estacao Deak Ter de Budapeste,artifact_159338|artifact_159343|artifact_159341|artifact_100427|artifact_100002,,artifact_100002,,0.0,1.0,0.2,,,204.16708700213348,5
T04,mnaz,text_single,full,scored,,,Named work,Edipo e a Esfinge,,,,,,,Edipo e a Esfinge,artifact_159341|artifact_159331|artifact_100013|artifact_159332|artifact_159336,,artifact_100013,,0.0,1.0,0.3333333333333333,,,149.77528199960943,5
T05,mnaz,text_single,full,scored,,,Semantic variant of T04,painel com Edipo e esfinge,,,,,,,painel com Edipo e esfinge,artifact_159341|artifact_159331|artifact_100013|artifact_100024|artifact_159343,,artifact_100013,,0.0,1.0,0.3333333333333333,,,71.15805799912778,5
T06,mnaz,text_single,full,scored,,,Named work,painel com Leda e o Cisne,,,,,,,painel com Leda e o Cisne,artifact_105515|artifact_99995|artifact_33916|artifact_100025|artifact_105524,,artifact_100025,,0.0,1.0,0.25,,,84.78733700030716,5
T07,mnaz,text_single,full,scored,,,Theme-driven retrieval,painel com duas figuras esfingicas e tres arvores,,,,,,,painel com duas figuras esfingicas e tres arvores,artifact_159341|artifact_159343|artifact_103056|artifact_100382|artifact_159331,,artifact_100014,,0.0,0.0,0.0,,,135.63682099993457,5
T08,mnaz,text_single,full,scored,,,Distinct iconographic scene,painel com duas figuras de convite masculinas,,,,,,,painel com duas figuras de convite masculinas,artifact_159343|artifact_159341|artifact_26872|artifact_100012|artifact_159345,,artifact_100012,,0.0,1.0,0.25,,,53.05993599904468,5
T09,mnt,text_single,full,scored,,,Tres Geracoes,pintura com tres figuras femininas,,,,,,,pintura com tres figuras femininas,artifact_113032|artifact_138503|artifact_136026|artifact_136027|artifact_136088,,artifact_10814,,0.0,0.0,0.0,,,161.64748500159476,5
T10,mnt,text_single,full,scored,,,Casaquinha/Crianca,casaquinha de crianca em veludo verde azulado,,,,,,,casaquinha de crianca em veludo verde azulado,artifact_134214|artifact_11343|artifact_136433|artifact_132949|artifact_134082,,artifact_11343,,0.0,1.0,0.5,,,77.46405899888487,5
T11,mnt,text_single,full,scored,,,Bolsa/Feminino,bolsa losango com penas de avestruz cor-de-rosa,,,,,,,bolsa losango com penas de avestruz cor-de-rosa,artifact_12464|artifact_134379|artifact_138445|artifact_134378|artifact_137584,,artifact_12464,,1.0,1.0,1.0,,,119.9667649998446,5
T12,mnt,text_single,full,scored,,,Capa/Feminino,capa vermelha de veludo com pelucia castanha,,,,,,,capa vermelha de veludo com pelucia castanha,artifact_134289|artifact_12519|artifact_137871|artifact_141682|artifact_36627,,artifact_12519,,0.0,1.0,0.5,,,73.37009500042768,5
T13,mnt,text_single,full,scored,,,Vestido/Feminino,vestido cinzento de tecido lavrado,,,,,,,vestido cinzento de tecido lavrado,artifact_13949|artifact_133454|artifact_135575|artifact_13959|artifact_136628,,artifact_12521,,0.0,0.0,0.0,,,105.6797210003424,5
T14,mnt,text_single,full,scored,,,Vestido/Feminino,vestido de tafeta amarelo torrado,,,,,,,vestido de tafeta amarelo torrado,artifact_140556|artifact_36571|artifact_133754|artifact_133705|artifact_133521,,artifact_12572,,0.0,0.0,0.0,,,74.80227499763714,5
T15,mnt,text_single,full,scored,,,Vestido de noiva/Feminino,vestido de noiva de cetim creme,,,,,,,vestido de noiva de cetim creme,artifact_133030|artifact_133038|artifact_133037|artifact_133043|artifact_13072,,artifact_12581,,0.0,0.0,0.0,,,66.89751500016428,5
T16,mnt,text_single,full,scored,,,Sapatos de noiva (par)/Feminino,sapatos de noiva em pele creme,,,,,,,sapatos de noiva em pele creme,artifact_140564|artifact_137691|artifact_12596|artifact_136729|artifact_18900,,artifact_12596,,0.0,1.0,0.3333333333333333,,,104.38077900107601,5
T17,mnt,text_single,full,scored,,,Sombrinha/Feminino,sombrinha com decoracao floral,,,,,,,sombrinha com decoracao floral,artifact_138266|artifact_37725|artifact_42274|artifact_141450|artifact_138475,,artifact_13022,,0.0,0.0,0.0,,,92.54568300093524,5
T18,mnt,text_single,full,scored,,,1955 wedding dress,vestido de noiva cor-de-rosa claro e branco,,,,,,,vestido de noiva cor-de-rosa claro e branco,artifact_133069|artifact_133081|artifact_13072|artifact_36614|artifact_133065,,artifact_13072,,0.0,1.0,0.3333333333333333,,,55.5298209983448,5
T19,mnt,text_single,full,scored,,,Luvas (par)/Feminino,luvas brancas sugerindo pelucia,,,,,,,luvas brancas sugerindo pelucia,artifact_134998|artifact_134198|artifact_138052|artifact_139604|artifact_139277,,artifact_13079,,0.0,0.0,0.0,,,90.69887099758489,5
T20,mnt,text_single,full,scored,,,Sapatos (par)/Feminino,sapatos de camurca preta,,,,,,,sapatos de camurca preta,artifact_137737|artifact_137733|artifact_135002|artifact_51274|artifact_51267,,artifact_13001,,0.0,0.0,0.0,,,71.06041700171772,5
T21,mnaz,text_multi,full,scored,,,,paineis azul sobre branco com busto masculino,,,,,,,paineis azul sobre branco com busto masculino,artifact_159343|artifact_159338|artifact_102723|artifact_159332|artifact_159331,,,artifact_100003|artifact_100005|artifact_100008|artifact_100009|artifact_100012,0.0,0.0,0.0,0.0,,73.53389000127208,5
T22,mnaz,text_multi,full,scored,,,,paineis azul sobre branco com busto feminino,,,,,,,paineis azul sobre branco com busto feminino,artifact_159343|artifact_104430|artifact_159338|artifact_100010|artifact_102723,,,artifact_100004|artifact_100006|artifact_100007|artifact_100010,0.0,1.0,0.25,0.16812753627111746,,66.94435999816051,5
T23,mnaz,text_multi,full,scored,,,,figuras de convite setecentistas fragmentadas,,,,,,,figuras de convite setecentistas fragmentadas,artifact_159344|artifact_159342|artifact_102318|artifact_100007|artifact_26872,,,artifact_100005|artifact_100006|artifact_100007|artifact_100008|artifact_100009|artifact_100010|artifact_100012,0.0,1.0,0.25,0.14606834984270645,,70.94752099874313,5
T24,mnaz,text_multi,full,scored,,,,paineis em faianca monocromatica azul sobre branco,,,,,,,paineis em faianca monocromatica azul sobre branco,artifact_105512|artifact_104807|artifact_104806|artifact_102723|artifact_103226,,,artifact_100003|artifact_100004|artifact_100005|artifact_100006|artifact_100007|artifact_100008|artifact_100009|artifact_100010|artifact_100012,0.0,0.0,0.0,0.0,,216.3972599992121,5
T25,mnt,text_multi,full,scored,,,,objetos de noiva,,,,,,,objetos de noiva,artifact_136729|artifact_36616|artifact_18900|artifact_140564|artifact_130814,,,artifact_12581|artifact_12596|artifact_13072|artifact_13079,0.0,0.0,0.0,0.0,,123.77650500275195,5
T26,mnt,text_multi,full,scored,,,,objetos em veludo,,,,,,,objetos em veludo,artifact_142144|artifact_140707|artifact_136476|artifact_137871|artifact_138628,,,artifact_11343|artifact_12519,0.0,0.0,0.0,0.0,,64.79290400238824,5
T27,mnt,text_multi,full,scored,,,,objetos com motivos florais,,,,,,,objetos com motivos florais,artifact_133437|artifact_133852|artifact_141538|artifact_136092|artifact_133834,,,artifact_11343|artifact_12464|artifact_13022,0.0,0.0,0.0,0.0,,114.00278200017055,5
T28,mnt,text_multi,full,scored,,,,pecas femininas dos anos 1930,,,,,,,pecas femininas dos anos 1930,artifact_133719|artifact_140870|artifact_134362|artifact_133547|artifact_133548,,,artifact_12519|artifact_12521|artifact_12572|artifact_12581|artifact_12596|artifact_13001,0.0,0.0,0.0,0.0,,79.62280600258964,5
R1,mnaz,rewriting_pair,full,scored,,,Target after Q1 in PDF: artifact_100004 / artifact_100006 / artifact_100010,,Mostra-me um painel com busto feminino de figura de convite.,E o masculino?,painel com busto masculino de figura de convite,,,,E o masculino?,artifact_159344|artifact_99388|artifact_159332|artifact_103580|artifact_159345,artifact_26872|artifact_100004|artifact_100006|artifact_100007|artifact_159343,,artifact_100003|artifact_100005|artifact_100008|artifact_100009,0.0,0.0,0.0,0.0,,150.69194099851302,5
R2,mnaz,rewriting_pair,full,scored,,,Target after Q1 in PDF: artifact_100013,,Mostra-me o painel com Edipo.,E o do cisne?,painel com Leda e o Cisne,,,,E o do cisne?,artifact_159331|artifact_159341|artifact_100025|artifact_100053|artifact_159338,artifact_159341|artifact_159331|artifact_100015|artifact_100561|artifact_159343,artifact_100025,,0.0,1.0,0.3333333333333333,,,132.97076200251468,5
R3,mnt,rewriting_pair,full,scored,,,Target after Q1 in PDF: artifact_12596,,Encontra os sapatos de noiva.,E o vestido?,vestido de noiva relacionado com os sapatos de noiva,,,,E o vestido?,artifact_49720|artifact_133440|artifact_133974|artifact_42324|artifact_134729,artifact_18900|artifact_140564|artifact_137694|artifact_136729|artifact_137691,,artifact_12581|artifact_13072,0.0,0.0,0.0,0.0,,105.95784399993136,5
R4,mnt,rewriting_pair,full,scored,,,Target after Q1 in PDF: artifact_12464,,Mostra-me a bolsa cor-de-rosa com penas.,E a capa vermelha?,capa vermelha de veludo com pelucia castanha,,,,E a capa vermelha?,artifact_140505|artifact_140521|artifact_136750|artifact_140527|artifact_7830,artifact_134379|artifact_134378|artifact_12464|artifact_135368|artifact_138445,artifact_12519,,0.0,0.0,0.0,,,108.831764999195,5
I01,mnaz,image,full,scored,,,Imagem de benchmark local para artifact_100000.,,,,,Identifica a peca correspondente a esta imagem.,/mnt/c/Users/tiago_-fernandes/Desktop/patrimonio360_assistant/backend/benchmarks/assets/mnaz/images/artifact_100000.jpg,,/mnt/c/Users/tiago_-fernandes/Desktop/patrimonio360_assistant/backend/benchmarks/assets/mnaz/images/artifact_100000.jpg,artifact_100000|artifact_102874|artifact_101569|artifact_104974|artifact_99383,,artifact_100000,,1.0,1.0,1.0,,,288.4203700014041,5
I02,mnaz,image,full,scored,,,Imagem de benchmark local para artifact_100002.,,,,,Identifica a peca correspondente a esta imagem.,/mnt/c/Users/tiago_-fernandes/Desktop/patrimonio360_assistant/backend/benchmarks/assets/mnaz/images/artifact_100002.jpg,,/mnt/c/Users/tiago_-fernandes/Desktop/patrimonio360_assistant/backend/benchmarks/assets/mnaz/images/artifact_100002.jpg,artifact_104913|artifact_17639|artifact_99952|artifact_102030|artifact_99853,,artifact_100002,,0.0,0.0,0.0,,,189.88449799871887,5
I03,mnaz,image,full,scored,,,Imagem de benchmark local para artifact_100013.,,,,,Identifica a peca correspondente a esta imagem.,/mnt/c/Users/tiago_-fernandes/Desktop/patrimonio360_assistant/backend/benchmarks/assets/mnaz/images/artifact_100013.jpg,,/mnt/c/Users/tiago_-fernandes/Desktop/patrimonio360_assistant/backend/benchmarks/assets/mnaz/images/artifact_100013.jpg,artifact_100013|artifact_99814|artifact_102764|artifact_34327|artifact_104847,,artifact_100013,,1.0,1.0,1.0,,,133.86116200126708,5
I04,mnaz,image,full,scored,,,Imagem de benchmark local para artifact_100025.,,,,,Identifica a peca correspondente a esta imagem.,/mnt/c/Users/tiago_-fernandes/Desktop/patrimonio360_assistant/backend/benchmarks/assets/mnaz/images/artifact_100025.jpg,,/mnt/c/Users/tiago_-fernandes/Desktop/patrimonio360_assistant/backend/benchmarks/assets/mnaz/images/artifact_100025.jpg,artifact_100025|artifact_101656|artifact_99814|artifact_102981|artifact_100587,,artifact_100025,,1.0,1.0,1.0,,,97.53173300123308,5
I05,mnt,image,full,scored,,,Imagem de benchmark local para artifact_11343.,,,,,Identifica a peca correspondente a esta imagem.,/mnt/c/Users/tiago_-fernandes/Desktop/patrimonio360_assistant/backend/benchmarks/assets/mnt/images/artifact_11343.jpg,,/mnt/c/Users/tiago_-fernandes/Desktop/patrimonio360_assistant/backend/benchmarks/assets/mnt/images/artifact_11343.jpg,artifact_11343|artifact_134082|artifact_140730|artifact_132726|artifact_140617,,artifact_11343,,1.0,1.0,1.0,,,97.7045609979541,5
I06,mnt,image,full,scored,,,Imagem de benchmark local para artifact_12464.,,,,,Identifica a peca correspondente a esta imagem.,/mnt/c/Users/tiago_-fernandes/Desktop/patrimonio360_assistant/backend/benchmarks/assets/mnt/images/artifact_12464.jpg,,/mnt/c/Users/tiago_-fernandes/Desktop/patrimonio360_assistant/backend/benchmarks/assets/mnt/images/artifact_12464.jpg,artifact_12464|artifact_134378|artifact_134379|artifact_135193|artifact_14826,,artifact_12464,,1.0,1.0,1.0,,,131.52194000213058,5
I07,mnt,image,full,scored,,,Imagem de benchmark local para artifact_12519.,,,,,Identifica a peca correspondente a esta imagem.,/mnt/c/Users/tiago_-fernandes/Desktop/patrimonio360_assistant/backend/benchmarks/assets/mnt/images/artifact_12519.jpg,,/mnt/c/Users/tiago_-fernandes/Desktop/patrimonio360_assistant/backend/benchmarks/assets/mnt/images/artifact_12519.jpg,artifact_12519|artifact_142519|artifact_134774|artifact_134821|artifact_18877,,artifact_12519,,1.0,1.0,1.0,,,111.83786200126633,5
I08,mnt,image,full,scored,,,Imagem de benchmark local para artifact_12581.,,,,,Identifica a peca correspondente a esta imagem.,/mnt/c/Users/tiago_-fernandes/Desktop/patrimonio360_assistant/backend/benchmarks/assets/mnt/images/artifact_12581.jpg,,/mnt/c/Users/tiago_-fernandes/Desktop/patrimonio360_assistant/backend/benchmarks/assets/mnt/images/artifact_12581.jpg,artifact_12581|artifact_133058|artifact_48466|artifact_133105|artifact_133080,,artifact_12581,,1.0,1.0,1.0,,,134.47110500055715,5
I09,mnt,image,full,scored,,,Imagem de benchmark local para artifact_12596.,,,,,Identifica a peca correspondente a esta imagem.,/mnt/c/Users/tiago_-fernandes/Desktop/patrimonio360_assistant/backend/benchmarks/assets/mnt/images/artifact_12596.jpg,,/mnt/c/Users/tiago_-fernandes/Desktop/patrimonio360_assistant/backend/benchmarks/assets/mnt/images/artifact_12596.jpg,artifact_12596|artifact_137690|artifact_135543|artifact_137677|artifact_44200,,artifact_12596,,1.0,1.0,1.0,,,131.01373500103364,5
I10,mnt,image,full,scored,,,Imagem de benchmark local para artifact_13022.,,,,,Identifica a peca correspondente a esta imagem.,/mnt/c/Users/tiago_-fernandes/Desktop/patrimonio360_assistant/backend/benchmarks/assets/mnt/images/artifact_13022.jpg,,/mnt/c/Users/tiago_-fernandes/Desktop/patrimonio360_assistant/backend/benchmarks/assets/mnt/images/artifact_13022.jpg,artifact_13022|artifact_141450|artifact_141427|artifact_142015|artifact_141439,,artifact_13022,,1.0,1.0,1.0,,,135.3886130018509,5
M01,mnt,model_3d,full,scored,,,"Vestia/Crianca, inventory 7617.",,,,,Identifica a peca correspondente a este modelo 3D.,/mnt/c/Users/tiago_-fernandes/Desktop/patrimonio360_assistant/backend/benchmarks/assets/mnt/models/artifact_132856.glb,,/mnt/c/Users/tiago_-fernandes/Desktop/patrimonio360_assistant/backend/benchmarks/assets/mnt/models/artifact_132856.glb,artifact_132856|artifact_132794|artifact_135375|artifact_132723|artifact_35610,,artifact_132856,,1.0,1.0,1.0,,105.36084400155232,2488.111275000847,5
M02,mnt,model_3d,full,scored,,,"Vestia/Masculino, inventory 3998.",,,,,Identifica a peca correspondente a este modelo 3D.,/mnt/c/Users/tiago_-fernandes/Desktop/patrimonio360_assistant/backend/benchmarks/assets/mnt/models/artifact_135373.glb,,/mnt/c/Users/tiago_-fernandes/Desktop/patrimonio360_assistant/backend/benchmarks/assets/mnt/models/artifact_135373.glb,artifact_135373|artifact_7852|artifact_137932|artifact_137538|artifact_132729,,artifact_135373,,1.0,1.0,1.0,,85.81520000007004,3162.4991270000464,5
M03,mnt,model_3d,full,scored,,,"Vestido/Crianca, inventory 28519/1.",,,,,Identifica a peca correspondente a este modelo 3D.,/mnt/c/Users/tiago_-fernandes/Desktop/patrimonio360_assistant/backend/benchmarks/assets/mnt/models/artifact_134370.glb,,/mnt/c/Users/tiago_-fernandes/Desktop/patrimonio360_assistant/backend/benchmarks/assets/mnt/models/artifact_134370.glb,artifact_134370|artifact_133899|artifact_50948|artifact_133914|artifact_42430,,artifact_134370,,1.0,1.0,1.0,,60.324750000290805,2069.514787999651,5
M04,mnt,model_3d,full,scored,,,"Bolsa/Feminino, inventory 967.",,,,,Identifica a peca correspondente a este modelo 3D.,/mnt/c/Users/tiago_-fernandes/Desktop/patrimonio360_assistant/backend/benchmarks/assets/mnt/models/artifact_133206.glb,,/mnt/c/Users/tiago_-fernandes/Desktop/patrimonio360_assistant/backend/benchmarks/assets/mnt/models/artifact_133206.glb,artifact_133206|artifact_141714|artifact_135143|artifact_137682|artifact_133247,,artifact_133206,,1.0,1.0,1.0,,75.75307700244593,2265.2966839996225,5
M05,mnt,model_3d,full,scored,,,"Casaca/Masculino, inventory 3972.",,,,,Identifica a peca correspondente a este modelo 3D.,/mnt/c/Users/tiago_-fernandes/Desktop/patrimonio360_assistant/backend/benchmarks/assets/mnt/models/artifact_133135.glb,,/mnt/c/Users/tiago_-fernandes/Desktop/patrimonio360_assistant/backend/benchmarks/assets/mnt/models/artifact_133135.glb,artifact_133135|artifact_140503|artifact_135375|artifact_140571|artifact_138032,,artifact_133135,,1.0,1.0,1.0,,30.74307299903012,2197.19659799739,5
M06,mnt,model_3d,full,scored,,,"Matine/Feminino, inventory 38746.",,,,,Identifica a peca correspondente a este modelo 3D.,/mnt/c/Users/tiago_-fernandes/Desktop/patrimonio360_assistant/backend/benchmarks/assets/mnt/models/artifact_39570.glb,,/mnt/c/Users/tiago_-fernandes/Desktop/patrimonio360_assistant/backend/benchmarks/assets/mnt/models/artifact_39570.glb,artifact_133780|artifact_133776|artifact_133833|artifact_133087|artifact_133426,,artifact_39570,,0.0,0.0,0.0,,74.80023800235358,2189.229923002131,5
M07,mnt,model_3d,full,scored,,,"Botao, inventory 4706.",,,,,Identifica a peca correspondente a este modelo 3D.,/mnt/c/Users/tiago_-fernandes/Desktop/patrimonio360_assistant/backend/benchmarks/assets/mnt/models/artifact_139991.glb,,/mnt/c/Users/tiago_-fernandes/Desktop/patrimonio360_assistant/backend/benchmarks/assets/mnt/models/artifact_139991.glb,artifact_139991|artifact_140005|artifact_139984|artifact_139998|artifact_139995,,artifact_139991,,1.0,1.0,1.0,,26.038577998406254,2045.397748999676,5
